{
  "$schema": "https://json-schema.org/draft/2020-12/schema",
  "$id": "https://home-mandate.org/mandate/v0/mandate.schema.json",
  "title": "Mandate v0",
  "description": "Describes what a software agent may do on behalf of a household. Working draft.",
  "type": "object",
  "additionalProperties": false,
  "required": ["type", "id", "principal", "agent", "rules", "default", "approval", "limits", "valid_from", "created_by", "created_at"],
  "dependentRequired": { "issuer": ["version"], "version": ["issuer"] },
  "properties": {
    "type": { "const": "https://home-mandate.org/mandate/v0" },
    "id": { "type": "string", "pattern": "^[A-Za-z0-9_-]{4,64}$" },
    "name": {
      "description": "Optional name of the mandate for user interfaces and confirmations; displayed text (SPEC-v0 section 3.1 item 8), not part of the evaluation.",
      "type": "string", "minLength": 1, "maxLength": 64
    },
    "principal": { "type": "string", "pattern": "^(household|person):[A-Za-z0-9_-]{1,64}$" },
    "agent": {
      "type": "object",
      "additionalProperties": false,
      "required": ["client_id", "display_name"],
      "properties": {
        "client_id": {
          "description": "Identifier of the agent, compared exactly per character (SPEC-v0 section 3.3).",
          "$ref": "#/$defs/uri"
        },
        "display_name": { "type": "string", "minLength": 1, "maxLength": 80 }
      }
    },
    "enforce": {
      "description": "Only false: audit mode (SPEC-v0 section 4.6). A deny that results from the rules of the valid, active mandate is evaluated and logged, but not enforced, unless the action is critical; if a matching rule decides ask, it is executed only after a confirmation. Absent: every decision is enforced. true is not permitted, so that a mandate that enforces has one form.",
      "const": false
    },
    "rules": {
      "type": "array",
      "maxItems": 200,
      "items": { "$ref": "#/$defs/rule" }
    },
    "default": {
      "description": "Always deny in v0. Anything no rule matches is forbidden.",
      "const": "deny"
    },
    "approval": { "$ref": "#/$defs/approval" },
    "limits": {
      "type": "object",
      "additionalProperties": false,
      "required": ["max_actions_per_hour"],
      "properties": {
        "max_actions_per_hour": { "type": "integer", "minimum": 1, "maximum": 1000 }
      }
    },
    "valid_from": { "$ref": "#/$defs/date_time" },
    "expires": { "$ref": "#/$defs/date_time" },
    "issuer": {
      "description": "Who issued the mandate; only together with version. Required in a signed mandate (SPEC-v0 sections 3.5 and 7).",
      "$ref": "#/$defs/uri"
    },
    "version": {
      "description": "Version of the mandate with this id, increasing with every change; only together with issuer.",
      "type": "integer",
      "minimum": 1,
      "maximum": 9007199254740991
    },
    "created_by": { "type": "string", "minLength": 1, "maxLength": 128 },
    "created_at": { "$ref": "#/$defs/date_time" }
  },
  "$defs": {
    "uri": {
      "description": "Either an https URL (lower-case host, a path, no userinfo, no fragment) or another URI such as <namespace>:<id>, did:web:..., spiffe://... or urn:.... Printable ASCII only, no dot segments.",
      "type": "string",
      "maxLength": 512,
      "allOf": [
        { "if": { "pattern": "^https:[!-~]*$" },
          "then": { "pattern": "^https://[a-z0-9]([a-z0-9.-]*[a-z0-9])?(:[0-9]{1,5})?/[A-Za-z0-9._~%!$&'()*+,;=:/?-]*$" },
          "else": { "pattern": "^[a-z][a-z0-9+.-]{0,31}:[A-Za-z0-9._~:/-]{1,256}$", "not": { "pattern": "^http:[!-~]*$" } } },
        { "not": { "pattern": "^[!-~]*/[.][.]?([/?][!-~]*)?$" } }
      ]
    },
    "date_time": {
      "description": "Timestamp according to RFC 3339 with offset, at most 9 fractional digits, not in year 0000 and not with the offset -00:00. Asserting format is required (SPEC-v0 section 3.1 item 0); pattern also catches gross errors in validators that treat format only as an annotation.",
      "type": "string",
      "format": "date-time",
      "pattern": "^[0-9]{4}-[0-9]{2}-[0-9]{2}T[0-9]{2}:[0-9]{2}:[0-9]{2}([.][0-9]{1,9})?(Z|[+-][0-9]{2}:[0-9]{2})$",
      "not": { "anyOf": [ { "pattern": "^0000[!-~]*$" }, { "pattern": "^[!-~]*-00:00$" } ] }
    },
    "category": {
      "anyOf": [
        { "enum": ["light", "switch", "climate", "cover", "gate", "lock", "alarm", "camera", "media", "sensor", "scene", "script", "other"] },
        { "type": "string", "pattern": "^[a-z][a-z0-9_-]{0,31}:[a-z][a-z0-9_]{0,31}$", "description": "Namespaced extension, e.g. paperless:document; each part at most 32 characters, as in a vocabulary file" }
      ]
    },
    "resource": {
      "type": "object",
      "additionalProperties": false,
      "minProperties": 1,
      "properties": {
        "entity_id": { "description": "Identifier of the resource in the directory of the implementation. Opaque: printable ASCII without space, compared exactly per character.", "type": "string", "pattern": "^[!-~]{1,255}$" },
        "category": { "$ref": "#/$defs/category" },
        "area": { "description": "Identifier of the area or group the resource belongs to. Opaque, compared exactly per character.", "type": "string", "pattern": "^[!-~]{1,64}$" },
        "any": { "const": true, "description": "Matches every resource. Only allowed on its own." }
      },
      "if": { "required": ["any"] },
      "then": { "maxProperties": 1 }
    },
    "approval": {
      "type": "object",
      "additionalProperties": false,
      "required": ["timeout", "approvers"],
      "properties": {
        "timeout": { "type": "string", "minLength": 4, "pattern": "^PT([0-9]{1,5}H)?([0-9]{1,5}M)?([0-9]{1,5}S)?$" },
        "approvers": {
          "description": "Identifiers, in the implementation's user management, of the people allowed to confirm approval requests.",
          "type": "array",
          "minItems": 1,
          "uniqueItems": true,
          "items": { "type": "string", "minLength": 1, "maxLength": 128 }
        }
      }
    },
    "conditions": {
      "type": "object",
      "additionalProperties": false,
      "minProperties": 1,
      "properties": {
        "time_window": { "type": "string", "pattern": "^([01][0-9]|2[0-3]):[0-5][0-9]-([01][0-9]|2[0-3]):[0-5][0-9]$" },
        "weekdays": {
          "type": "array",
          "minItems": 1,
          "uniqueItems": true,
          "items": { "enum": ["mon", "tue", "wed", "thu", "fri", "sat", "sun"] }
        }
      }
    },
    "limit": {
      "description": "An integer in the unit the vocabulary gives the parameter, as a limit or a permitted value. Mandates contain no fractions, so that the canonical form needs no floating-point serialization.",
      "type": "integer",
      "minimum": -9007199254740991,
      "maximum": 9007199254740991
    },
    "text": {
      "description": "A string parameter value: 1 to 64 printable ASCII characters without space, compared exactly and case-sensitive, like an area (SPEC-v0 sections 3.4 and 4.5).",
      "type": "string",
      "pattern": "^[!-~]{1,64}$"
    },
    "constraints": {
      "description": "Only with allow: constraints on parameters of the action. The rule matches only if the request carries every named parameter with a value the constraint permits (SPEC-v0 section 4.5).",
      "type": "object",
      "minProperties": 1,
      "maxProperties": 16,
      "propertyNames": { "pattern": "^[a-z][a-z0-9_]{0,63}$" },
      "additionalProperties": {
        "oneOf": [
          {
            "description": "Limits for an integer parameter.",
            "type": "object",
            "additionalProperties": false,
            "minProperties": 1,
            "properties": {
              "min": { "$ref": "#/$defs/limit", "description": "Smallest permitted value, inclusive." },
              "max": { "$ref": "#/$defs/limit", "description": "Largest permitted value, inclusive." }
            }
          },
          {
            "description": "The permitted values of an integer or string parameter, all of the same type; not together with min or max.",
            "type": "object",
            "additionalProperties": false,
            "required": ["one_of"],
            "properties": {
              "one_of": {
                "type": "array",
                "minItems": 1,
                "maxItems": 32,
                "uniqueItems": true,
                "anyOf": [
                  { "items": { "$ref": "#/$defs/limit" } },
                  { "items": { "$ref": "#/$defs/text" } }
                ]
              }
            }
          }
        ]
      }
    },
    "rule": {
      "type": "object",
      "additionalProperties": false,
      "required": ["id", "resource", "actions", "decision"],
      "properties": {
        "id": { "type": "string", "pattern": "^[A-Za-z0-9_-]{1,64}$" },
        "resource": { "$ref": "#/$defs/resource" },
        "actions": {
          "description": "Actions from the vocabulary or \"*\". The implementation checks whether an action fits the category (SPEC-v0 section 3.1 item 4).",
          "type": "array",
          "minItems": 1,
          "uniqueItems": true,
          "items": { "type": "string", "pattern": "^(\\*|[a-z][a-z0-9_]{0,63})$" }
        },
        "decision": { "enum": ["allow", "ask", "deny"] },
        "note": {
          "description": "Optional explanation of the rule for user interfaces and confirmations (by which rule); displayed text (SPEC-v0 section 3.1 item 8), not part of the evaluation.",
          "type": "string", "minLength": 1, "maxLength": 200
        },
        "conditions": { "$ref": "#/$defs/conditions" },
        "constraints": { "$ref": "#/$defs/constraints" },
        "approval": { "$ref": "#/$defs/approval" },
        "allow_critical": {
          "description": "Only with allow and only with the actions listed, not with \"*\": permits critical actions without an approval request. Must be confirmed separately in the user interface.",
          "const": true
        }
      },
      "allOf": [
        { "if": { "required": ["approval"] }, "then": { "properties": { "decision": { "const": "ask" } } } },
        { "if": { "required": ["allow_critical"] }, "then": { "properties": { "decision": { "const": "allow" } } } },
        { "if": { "required": ["allow_critical"] }, "then": { "properties": { "actions": { "not": { "contains": { "const": "*" } } } } } },
        { "if": { "required": ["constraints"] }, "then": { "properties": { "decision": { "const": "allow" }, "actions": { "not": { "contains": { "const": "*" } } } } } }
      ]
    }
  }
}
