{
  "type": "https://home-mandate.org/mandate/v0",
  "id": "m-shopping-agent",
  "principal": "person:p-7c1e",
  "agent": { "client_id": "hm-client:shop-19b0f3d2", "display_name": "Shopping agent" },
  "rules": [
    { "id": "r-pantry", "resource": { "category": "sensor", "area": "pantry" }, "actions": ["read"], "decision": "allow" },
    { "id": "r-fridge", "resource": { "entity_id": "sensor.fridge_contents" }, "actions": ["read"], "decision": "allow",
      "conditions": { "weekdays": ["mon", "tue", "wed", "thu", "fri", "sat"] } }
  ],
  "default": "deny",
  "approval": { "timeout": "PT2M", "approvers": ["user-1"] },
  "limits": { "max_actions_per_hour": 20 },
  "valid_from": "2026-10-01T00:00:00+02:00",
  "created_by": "user-1",
  "created_at": "2026-10-01T09:25:00+02:00"
}
