{
  "type": "https://home-mandate.org/mandate/v0",
  "id": "m-conf-one-of",
  "principal": "household:conf",
  "agent": {"client_id": "urn:example:agent:conf-one-of", "display_name": "Conformance permitted values"},
  "rules": [
    {"id": "r-heating-modes", "resource": {"category": "climate"}, "actions": ["set_mode"], "decision": "allow", "constraints": {"mode": {"one_of": ["heat", "auto"]}}},
    {"id": "r-light-steps", "resource": {"category": "light"}, "actions": ["set"], "decision": "allow", "constraints": {"brightness": {"one_of": [0, 50, 100]}}}
  ],
  "default": "deny",
  "approval": {"timeout": "PT1M", "approvers": ["approver-1"]},
  "limits": {"max_actions_per_hour": 60},
  "valid_from": "2026-01-01T00:00:00+01:00",
  "created_by": "approver-1",
  "created_at": "2025-12-31T12:00:00+01:00"
}
