{
  "type": "https://home-mandate.org/mandate/v0",
  "id": "m-conf-audit-mode-critical",
  "principal": "household:conf",
  "agent": { "client_id": "urn:example:agent:conf-audit-mode-critical", "display_name": "Conformance audit mode critical" },
  "enforce": false,
  "rules": [
    { "id": "r-no-switching", "resource": { "category": "switch" }, "actions": ["turn_on", "turn_off"], "decision": "deny" }
  ],
  "default": "deny",
  "approval": { "timeout": "PT1M", "approvers": ["approver-1"] },
  "limits": { "max_actions_per_hour": 60 },
  "valid_from": "2026-01-01T00:00:00+01:00",
  "created_by": "approver-1",
  "created_at": "2025-12-31T12:00:00+01:00"
}
