{
  "type": "https://home-mandate.org/mandate/v0",
  "id": "m-energy-agent",
  "principal": "household:hm-7f3a",
  "agent": { "client_id": "https://energy-agent.example/oauth/client.json", "display_name": "Energy agent" },
  "rules": [
    { "id": "r-read-sensors", "resource": { "category": "sensor" }, "actions": ["read"], "decision": "allow" },
    { "id": "r-climate", "resource": { "category": "climate" }, "actions": ["read", "set_temperature", "set_mode"], "decision": "allow" },
    { "id": "r-wallbox", "resource": { "entity_id": "number.wallbox_charge_current" }, "actions": ["read", "set"], "decision": "allow",
      "allow_critical": true, "conditions": { "time_window": "06:00-22:00" } },
    { "id": "r-pool-pump", "resource": { "entity_id": "switch.pool_pump" }, "actions": ["read", "turn_on", "turn_off"], "decision": "allow" }
  ],
  "default": "deny",
  "approval": { "timeout": "PT2M", "approvers": ["user-1"] },
  "limits": { "max_actions_per_hour": 30 },
  "valid_from": "2026-10-01T00:00:00+02:00",
  "expires": "2027-10-01T00:00:00+02:00",
  "created_by": "user-1",
  "created_at": "2026-10-01T09:20:00+02:00"
}
